{
  "schema_version": "pllm.reproduction_recipe.v1",
  "registry_alias": "R02",
  "kind": "planned_workflow",
  "source_acquisition_status": "acquired",
  "workflow_status": "not_executed",
  "primary_url": "https://arxiv.org/html/2506.14489v1",
  "dependencies": [
    "R01",
    "R03"
  ],
  "target_modules": [
    "convert.rns_base_extension",
    "gate.scale",
    "numeric.scalequant_plus"
  ],
  "source_lock": {
    "paper_sha256": "9c11e012e7802990a2c35986cb134f67979549ef28bdd890114b3c14f9116a1c",
    "artifact_commit": "894e2bb7e104c2996933d53f4aa7ca58f2c802be",
    "license_review": "external_reproduction_only"
  },
  "original_artifact_command": null,
  "pllm_reproduction_command": null,
  "publication_workload": null,
  "required_evidence": [
    "source.lock.json",
    "fidelity.md",
    "environment.json",
    "model_or_fixture.lock.json",
    "plan.lock.json",
    "correctness.json",
    "assurance.json",
    "raw_samples.jsonl",
    "all_party_resources.json",
    "reproduction_report.md"
  ],
  "failure_policy": "record_missing_source_or_implementation; never invoke plaintext fallback",
  "gates": [
    "acquire",
    "specify",
    "reference",
    "fidelity",
    "native",
    "compose",
    "assure",
    "benchmark",
    "document"
  ]
}
