{
  "schema_version": "pllm.reproduction_recipe.v1",
  "registry_alias": "R17",
  "kind": "planned_workflow",
  "source_acquisition_status": "not_acquired",
  "workflow_status": "not_executed",
  "primary_url": "https://eprint.iacr.org/2024/1127",
  "dependencies": [],
  "target_modules": [
    "gate.wavelet_lookup",
    "numeric.wavelet",
    "gate.probabilistic_truncation"
  ],
  "source_lock": {
    "paper_sha256": null,
    "artifact_commit": null,
    "license_review": "required_before_vendoring"
  },
  "original_artifact_command": null,
  "pllm_reproduction_command": null,
  "publication_workload": null,
  "required_evidence": [
    "source.lock.json",
    "fidelity.md",
    "environment.json",
    "model_or_fixture.lock.json",
    "plan.lock.json",
    "correctness.json",
    "assurance.json",
    "raw_samples.jsonl",
    "all_party_resources.json",
    "reproduction_report.md"
  ],
  "failure_policy": "record_missing_source_or_implementation; never invoke plaintext fallback",
  "gates": [
    "acquire",
    "specify",
    "reference",
    "fidelity",
    "native",
    "compose",
    "assure",
    "benchmark",
    "document"
  ]
}
